<?xml version="1.0" encoding="UTF-8"?>
<eventos xmlns:xsi="http://www.w3.org/2001/XMLSchema-instance" xsi:noNamespaceSchemaLocation="eventos.xsd">
    <talleres>
      <tipo>taller</tipo>
      <nombre>taller de cocina</nombre>
      <fecha>2019-06-12</fecha>
      <precio>Gratuito</precio>
    </talleres>
    <talleres>
      <tipo>taller</tipo>
      <nombre>taller de reposteria</nombre>
      <fecha>2019-06-16</fecha>
      <precio>Gratuito</precio>
    </talleres>
    </eventos>
